{
  "schemaVersion": "lekalo/change-catalog/v0.8.0",
  "identity": "dev.lekalo.change-catalog@0.8.0",
  "closed": true,
  "operations": [
    {
      "operation": "binding:add",
      "status": "implemented",
      "title": "Add a canonical or confirmed-observed target binding",
      "mutationClass": "administrative",
      "requiredEvidence": [
        "binding-proof"
      ]
    },
    {
      "operation": "command-effect:add",
      "status": "implemented",
      "title": "Add one effect or emission to a command",
      "mutationClass": "member-additive",
      "requiredEvidence": [
        "emission-representation"
      ]
    },
    {
      "operation": "command-effect:remove",
      "status": "implemented",
      "title": "Remove one effect or emission from a command",
      "mutationClass": "member-destructive",
      "requiredEvidence": []
    },
    {
      "operation": "definition:add",
      "status": "implemented",
      "title": "Add one command, query, event, policy, or scenario definition",
      "mutationClass": "additive",
      "requiredEvidence": [
        "kind-declaration"
      ]
    },
    {
      "operation": "entity-field:add",
      "status": "implemented",
      "title": "Add one field to an entity or value-object",
      "mutationClass": "additive",
      "requiredEvidence": []
    },
    {
      "operation": "entity-field:remove",
      "status": "implemented",
      "title": "Remove one field from an entity or value-object",
      "mutationClass": "member-destructive",
      "requiredEvidence": []
    },
    {
      "operation": "entity-field:rename",
      "status": "implemented",
      "title": "Rename one field of an entity or value-object in place",
      "mutationClass": "member-destructive",
      "requiredEvidence": []
    },
    {
      "operation": "enum-case:add",
      "status": "implemented",
      "title": "Add one case to an enum definition",
      "mutationClass": "additive",
      "requiredEvidence": []
    },
    {
      "operation": "enum-case:change",
      "status": "implemented",
      "title": "Rename or redescribe one enum case",
      "mutationClass": "member-destructive",
      "requiredEvidence": [
        "wire-value-review"
      ]
    },
    {
      "operation": "migration:apply",
      "status": "implemented",
      "title": "Apply one registered application-model migration step",
      "mutationClass": "destructive",
      "requiredEvidence": [
        "registered-step"
      ]
    },
    {
      "operation": "module:move",
      "status": "implemented",
      "title": "Relocate one module directory preserving its semantic ID",
      "mutationClass": "administrative",
      "requiredEvidence": []
    },
    {
      "operation": "operation-error:set",
      "status": "unsupported",
      "title": "Set the error attachment surface of one operation",
      "mutationClass": "member-destructive",
      "requiredEvidence": [
        "error-binding"
      ]
    },
    {
      "operation": "operation-input:set",
      "status": "implemented",
      "title": "Set the input surface of one operation",
      "mutationClass": "member-destructive",
      "requiredEvidence": [
        "query-input-review"
      ]
    },
    {
      "operation": "operation-output:set",
      "status": "implemented",
      "title": "Set the output surface of one operation",
      "mutationClass": "member-destructive",
      "requiredEvidence": [
        "query-return-review"
      ]
    },
    {
      "operation": "ownership:set",
      "status": "unsupported",
      "title": "Change the adoption ownership mode of one subject",
      "mutationClass": "administrative",
      "requiredEvidence": [
        "ownership-proof"
      ]
    },
    {
      "operation": "query-effect:add",
      "status": "implemented",
      "title": "Add one read-semantics effect to a query",
      "mutationClass": "member-additive",
      "requiredEvidence": [
        "read-semantics-review"
      ]
    },
    {
      "operation": "query-effect:remove",
      "status": "implemented",
      "title": "Remove one effect from a query",
      "mutationClass": "member-destructive",
      "requiredEvidence": []
    },
    {
      "operation": "requirement:link",
      "status": "implemented",
      "title": "Link one requirement to a symbol",
      "mutationClass": "member-additive",
      "requiredEvidence": []
    },
    {
      "operation": "requirement:unlink",
      "status": "implemented",
      "title": "Unlink one requirement from a symbol",
      "mutationClass": "member-destructive",
      "requiredEvidence": []
    },
    {
      "operation": "symbol:move",
      "status": "unsupported",
      "title": "Move one symbol to another module or name",
      "mutationClass": "destructive",
      "requiredEvidence": [
        "reference-rewrite"
      ]
    }
  ]
}
